{
  "scene_id": "ABEiM0RVZneImaq7zN3u_w",
  "lease_ms": 3000,
  "brightness": 72,
  "playback": {"mode": "loop"},
  "keyframes": [
    {
      "transition": {"kind": "linear", "duration_ms": 400},
      "hold_ms": 600,
      "cells": [
        [96, 16, 180],
        [48, 8, 90],
        [0, 0, 0],
        [0, 0, 0],
        [0, 0, 0],
        [0, 0, 0]
      ]
    },
    {
      "transition": {"kind": "linear", "duration_ms": 400},
      "hold_ms": 600,
      "cells": [
        [0, 0, 0],
        [96, 16, 180],
        [48, 8, 90],
        [0, 0, 0],
        [0, 0, 0],
        [0, 0, 0]
      ]
    }
  ]
}
